vcenter center

Filter on live traffic:

~$ sudo tcpdump 'ip and udp port 53'
~tcpdump: verbose output suppressed, use -v or -vv for full protocol decode
~listening on eth0, link-type EN10MB (Ethernet), capture size 262144 bytes
~17:28:12.327506 IP workshop.48247 > 10.0.2.3.domain: 21269+ [1au] A? example.com. (40)
~17:28:12.328019 IP workshop.37770 > 10.0.2.3.domain: 44247+ [1au] PTR? 3.2.0.10.in-addr.arpa. (50)
~17:28:12.344904 IP 10.0.2.3.domain > workshop.48247: 21269 1/0/1 A 93.184.216.34 (56)
~17:28:12.345865 IP 10.0.2.3.domain > workshop.37770: 44247 NXDomain 0/0/1 (50)
~17:28:12.346042 IP workshop.37770 > 10.0.2.3.domain: 44247+ PTR? 3.2.0.10.in-addr.arpa. (39)
~17:28:12.347350 IP workshop.58709 > 10.0.2.3.domain: 51009+ [1au] AAAA? example.com. (40)
~17:28:12.353929 IP 10.0.2.3.domain > workshop.37770: 44247 NXDomain 0/0/0 (39)
